ID,VENUE_NUMBER,SERVICE_ID,TYPE,PHRASE,WEIGHT,FOR_DAY,FULL_TEXT
25441109,171532,59174,CRG,distance,0,"2022-06-28 17:05:21","how far is the hotel from the airport"
25441108,171532,59173,CRG,distance,0,"2022-06-28 17:03:22","how far is the hotel from the airport"
25441107,171532,59170,CRG,distance,0,"2022-06-28 17:00:44","how far is the hotel from the airport"
25441106,171532,59169,CRG,distance,0,"2022-06-28 16:54:19","how far is the hotel from the airport"
25441105,171681,59160,CRG,wifi,0,"2022-06-28 15:55:14",Wi-Fi
25441104,171672,59141,CRG,"check out",0,"2022-06-28 13:43:20","What time is checkout"
25441103,171672,59141,CRG,"hours of operation",0,"2022-06-28 13:43:20","What time is checkout"
25441102,171687,59129,CRG,"hours of operation",0,"2022-06-28 12:12:03","Groceries stores close by?"
25441101,171649,59120,CRG,breakfast,0,"2022-06-28 04:29:44","What time is breakfast?"
25441100,171649,59120,CRG,"hours of operation",0,"2022-06-28 04:29:44","What time is breakfast?"
25441099,171688,59113,CRG,"room service",0,"2022-06-28 02:31:58","Room service"
25441098,171622,59111,CRG,"Ice machine",0,"2022-06-28 02:08:03","Where is the ice machine"
25441097,171622,59111,CRG,location,0,"2022-06-28 02:08:03","Where is the ice machine"
25441096,171622,59109,CRG,breakfast,0,"2022-06-28 01:54:12","What time is breakfast served"
25441095,171622,59109,CRG,"hours of operation",0,"2022-06-28 01:54:12","What time is breakfast served"
25441094,171532,59090,CRG,"hours of operation",0,"2022-06-28 00:35:38","Pool hours"
25441093,171532,59090,CRG,pool,0,"2022-06-28 00:35:38","Pool hours"
25441092,171691,59089,CRG,"room service",0,"2022-06-28 00:34:51","cardapio room service"
25441091,171613,59085,CRG,breakfast,0,"2022-06-28 00:27:28","Thank you! When is check out time? And what time is breakfast?"
25441090,171613,59085,CRG,"hours of operation",0,"2022-06-28 00:27:28","Thank you! When is check out time? And what time is breakfast?"
25441089,171613,59085,CRG,"checkout time",0,"2022-06-28 00:27:28","Thank you! When is check out time? And what time is breakfast?"
25441088,171636,59077,CRG,"room service",0,"2022-06-27 23:28:23","Me pueden compartir menú room service"
25441087,171649,59076,CRG,laundry,0,"2022-06-27 23:15:09","Do you have laundry facilities here?"
25441086,171649,59074,CRG,"hours of operation",0,"2022-06-27 22:49:12","What time does the outdoor pool close"
25441085,171649,59074,CRG,"hours of operation",0,"2022-06-27 22:49:12","What time does the outdoor pool close"
25441084,171649,59074,CRG,pool,0,"2022-06-27 22:49:12","What time does the outdoor pool close"
25441083,171649,59073,CRG,"hours of operation",0,"2022-06-27 22:48:35","what time does the indoor pool close"
25441082,171649,59073,CRG,"hours of operation",0,"2022-06-27 22:48:35","what time does the indoor pool close"
25441081,171649,59073,CRG,pool,0,"2022-06-27 22:48:35","what time does the indoor pool close"
25441080,171649,59065,CRG,wifi,0,"2022-06-27 22:33:01","Wifi password"
25441079,171644,59050,CRG,"hours of operation",0,"2022-06-27 21:51:03","Trying the Wi-Fi password for The Lodge Guest 5.0, 
copy pasted and also entered one letter at a time. Neither is working-

welcome2thelodge

Thanks"
25441078,171644,59050,CRG,wifi,0,"2022-06-27 21:51:03","Trying the Wi-Fi password for The Lodge Guest 5.0, 
copy pasted and also entered one letter at a time. Neither is working-

welcome2thelodge

Thanks"
25441077,171644,59050,CRG,wifi,0,"2022-06-27 21:51:03","Trying the Wi-Fi password for The Lodge Guest 5.0, 
copy pasted and also entered one letter at a time. Neither is working-

welcome2thelodge

Thanks"
25441076,171532,59049,CRG,"shuttle service",0,"2022-06-27 21:40:28","Hello, I scheduled a shuttle and would like to confirm. Who can I reach out to?"
25441075,171559,59046,CRG,parking,0,"2022-06-27 21:30:11","Parking for 2 vehicles was $95"
25441074,171572,59043,CRG,"checkout time",0,"2022-06-27 21:18:43","Hello what is the Checkout time"
25441073,171532,59040,CRG,reservations,0,"2022-06-27 21:11:58","My reservation is for our anniversary"
25441072,171557,59032,CRG,"complimentary breakfast",0,"2022-06-27 20:46:31","Free breakfast 😉"
25441071,171480,59028,CRG,"near by",0,"2022-06-27 20:21:03","Nearby attractions?"
25441070,171480,59028,CRG,attractions,0,"2022-06-27 20:21:03","Nearby attractions?"
25441069,171859,59027,CRG,microwave,0,"2022-06-27 20:18:57","Do you have microwave in the room"
25441068,171483,59026,CRG,amenities,0,"2022-06-27 20:18:08","Full payment required up front, yet most amenities are not available this trip"
25441067,171691,59021,CRG,Check-in,0,"2022-06-27 20:13:45","Hola, quieres que haga ore check in con 2 días de anticipación?"
25441066,171687,59005,CRG,"near by",0,"2022-06-27 19:54:12","what restaurants are nearby?"
25441065,171687,59004,CRG,"body wash",0,"2022-06-27 19:53:57","No soap in room. TV does not work. Poor first impression."
25441064,171687,59002,CRG,"body wash",0,"2022-06-27 19:18:06","Our room does not have any hand soap. Pls provide. Rm 110"
25441063,171687,58988,CRG,wifi,0,"2022-06-27 17:06:54",WiFi
25441062,171687,58987,CRG,wifi,0,"2022-06-27 17:06:52",WiFi
25441061,171613,58986,CRG,"check out",0,"2022-06-27 16:25:06","There's no one in the office. Anything i need to do to check out?"
25441060,171631,58983,CRG,"extra towels",0,"2022-06-27 15:17:52","I need a towel"
25441059,171631,58982,CRG,wifi,0,"2022-06-27 15:17:39","WiFi password"
25441058,171613,58972,CRG,"check out",0,"2022-06-27 14:40:35","Hi, thanks. What time is check out?"
25441057,171613,58972,CRG,"hours of operation",0,"2022-06-27 14:40:35","Hi, thanks. What time is check out?"
25441056,171649,58969,CRG,breakfast,0,"2022-06-27 12:50:45","What are the times of breakfast ?"
25441055,521,58966,CRG,"dress code",0,"2022-06-27 06:00:18","Dress code"
25441054,521,58960,CRG,"bottle service",0,"2022-06-27 04:19:34","Bottle service"
25441053,521,58959,CRG,"reserve a table",0,"2022-06-27 04:19:12","Reserve a table"
25441052,521,58954,CRG,"cover charge",0,"2022-06-27 03:32:26","Hello how much is the cover for tonight"
25441051,521,58951,CRG,"reserve a table",0,"2022-06-27 02:36:04","Hi I would like to know how much you guys charge for a table"
25441050,171629,58947,CRG,breakfast,0,"2022-06-27 02:11:38",Breakfast
25441049,171629,58946,CRG,coffee,0,"2022-06-27 02:11:25",Coffee
25441048,521,58937,CRG,"bottle service",0,"2022-06-27 01:22:31","Bottle prices"
25441047,521,58936,CRG,"bottle service",0,"2022-06-27 01:22:13","View bottle menu"
25441046,521,58933,CRG,program,0,"2022-06-27 00:59:57",Events
25441045,521,58932,CRG,"bottle service",0,"2022-06-27 00:59:39","How much is bottle service"
25441044,171443,58921,CRG,amenities,0,"2022-06-26 23:41:08","4 
There could have more explanation on use of elevators and amenities."
25441043,171672,58915,CRG,billing,0,"2022-06-26 23:03:59","A couple questions 
Where are ice machines 
Is there free breakfast
I need a copy of the receipt, do you provide that when we leave"
25441042,171622,58909,CRG,pool,0,"2022-06-26 22:23:04","Can we get extra towels for swimming in the pool and hot tub"
25441041,171637,58905,CRG,Check-in,0,"2022-06-26 22:21:49","What time to check in"
25441040,171637,58905,CRG,"hours of operation",0,"2022-06-26 22:21:49","What time to check in"
25441039,171622,58904,CRG,bar,0,"2022-06-26 22:18:34","Where is a good place/ bar to watch the Colorado  Avalanche play tonight?"
25441038,171622,58904,CRG,location,0,"2022-06-26 22:18:34","Where is a good place/ bar to watch the Colorado  Avalanche play tonight?"
25441037,171235,58882,CRG,wifi,0,"2022-06-26 21:08:24","Wi-Fi password?"
25441036,171235,58882,CRG,wifi,0,"2022-06-26 21:08:24","Wi-Fi password?"
25441035,171649,58880,CRG,wifi,0,"2022-06-26 20:32:58","Wifi password?"
25441034,171637,58876,CRG,"tour packages",0,"2022-06-26 20:18:26","I have question regarding excursion tours. Do I get to signup from the hotel?"
25441033,171445,58864,CRG,laundry,0,"2022-06-26 18:30:39","Are there laundry facilities at the hotel?"
25441032,171649,58863,CRG,breakfast,0,"2022-06-26 18:27:44","What time is breakfast served ?"
25441031,171649,58863,CRG,"hours of operation",0,"2022-06-26 18:27:44","What time is breakfast served ?"
25441030,171559,58862,CRG,"checkout time",0,"2022-06-26 17:42:38","Checkout time?"
25441029,171622,58856,CRG,"late checkout",0,"2022-06-26 16:10:40","Is a late checkout available ?"
25441028,171622,58855,CRG,"hours of operation",0,"2022-06-26 16:03:10",Time?
25441027,171622,58854,CRG,"check out",0,"2022-06-26 16:03:02","What is check out ?"
25441026,171559,58852,CRG,"checkout time",0,"2022-06-26 15:58:48","When is check out time?"
25441025,171681,58849,CRG,"late checkout",0,"2022-06-26 15:36:03","We requested late check out and want to verify"
25441024,171634,58845,CRG,Check-in,0,"2022-06-26 13:14:44","A qué horas es mi checkin?"
25441023,171651,58844,CRG,breakfast,0,"2022-06-26 12:49:29",Breakfast
25441022,171651,58843,CRG,"hours of operation",0,"2022-06-26 12:49:18","What time does break end?"
25441021,171649,58842,CRG,"check out",0,"2022-06-26 12:48:27","When someone checks in after 11 pm and can't get an extension on checkout . 200.00 for half a day is really disappointing"
25441020,171532,58841,CRG,gym,0,"2022-06-26 12:47:54","Price gym?"
25441019,171532,58840,CRG,gym,0,"2022-06-26 12:47:32","Is there a fee to use gym?"
25441018,171532,58839,CRG,gym,0,"2022-06-26 12:47:31","Is there a fee to use gym?"
25441017,171532,58838,CRG,gym,0,"2022-06-26 12:47:03","Good morning is there a fee to ise gym ?"
25441016,171681,58837,CRG,breakfast,0,"2022-06-26 12:37:46",Breakfast
25441015,171681,58836,CRG,"checkout time",0,"2022-06-26 12:37:40","Checkout time"
25441014,171681,58835,CRG,"checkout time",0,"2022-06-26 12:37:35","Check out time"
25441013,171644,58832,CRG,"not working",0,"2022-06-26 11:33:30","Hello - is my shower water not working? Or is there a time it turns on?"
25441012,171644,58832,CRG,"hours of operation",0,"2022-06-26 11:33:30","Hello - is my shower water not working? Or is there a time it turns on?"
25441011,521,58824,CRG,"cover charge",0,"2022-06-26 05:49:31","Cover charges?"
25441010,521,58823,CRG,"reserve a table",0,"2022-06-26 05:28:38","Hello, what is the price for a table for 8?"
25441009,521,58822,CRG,"bottle service",0,"2022-06-26 05:24:03","Bottle service price"
25441008,521,58820,CRG,"dress code",0,"2022-06-26 05:08:31","Dress code"
25441007,521,58819,CRG,"dress code",0,"2022-06-26 04:41:07","Dress code"
25441006,521,58816,CRG,"dress code",0,"2022-06-26 04:33:12","Dress code"
25441005,521,58815,CRG,"cover charge",0,"2022-06-26 04:25:31",Cover
25441004,521,58813,CRG,"cover charge",0,"2022-06-26 04:05:50","Cover charges"
25441003,521,58812,CRG,"guet list",0,"2022-06-26 04:01:09","Id like to get on the guest list for tonight"
25441002,521,58797,CRG,"dress code",0,"2022-06-26 02:24:35","Dress code"
25441001,521,58796,CRG,"dress code",0,"2022-06-26 01:53:08","Dress code"
25441000,171687,58794,CRG,phone,0,"2022-06-26 01:33:26","There is no phone here"
25440999,171443,58793,CRG,ATM,0,"2022-06-26 01:25:10","It would be nice if you had an atm on-site."
25440998,521,58788,CRG,"reserve a table",0,"2022-06-26 00:47:19","I want to reserve a table ?"
25440997,171651,58787,CRG,"checkout time",0,"2022-06-26 00:41:10","Checkout time"
25440996,171651,58784,CRG,bar,0,"2022-06-26 00:37:55",Bar?
25440995,171651,58783,CRG,location,0,"2022-06-26 00:37:46","Where is the best strip club?"
25440994,521,58772,CRG,"reserve a table",0,"2022-06-25 23:50:10","How much to reserve a table"
25440993,171559,58753,CRG,location,0,"2022-06-25 22:26:03","Great hotel, great location"
25440992,171622,58747,CRG,"hours of operation",0,"2022-06-25 22:15:13","What restaurants are close by?"
25440991,521,58743,CRG,"cover charge",0,"2022-06-25 22:07:03","Is there a cover charge tonight"
25440990,171681,58741,CRG,wifi,0,"2022-06-25 22:01:17","What is the access code for the Wi-Fi"
25440989,171681,58736,CRG,amenities,0,"2022-06-25 21:38:05","What are the amenities?"
25440988,171681,58735,CRG,"late checkout",0,"2022-06-25 21:37:37","Can I have late check out?"
25440987,171681,58734,CRG,"checkout time",0,"2022-06-25 21:37:27","What is the checkout time?"
25440986,171480,58732,CRG,amenities,0,"2022-06-25 21:18:14",Amenities
25440985,171637,58727,CRG,Check-in,0,"2022-06-25 21:05:47","Ok. Pre check in ya hecho. 
Es posible que nos den un cuarto con balcón completo?"
25440984,521,58726,CRG,"dress code",0,"2022-06-25 21:04:12","Dress code"
25440983,171637,58725,CRG,Check-in,0,"2022-06-25 21:03:46","Pre check in ya hecho. 
Es posible que nos den un cuarto con balcón completo?"
25440982,171687,58708,CRG,"channel lineup",0,"2022-06-25 19:17:59","Hello there, we only have one channel on our tv"
25440981,171681,58706,CRG,"not working",0,"2022-06-25 19:10:17","AV is Not working room 622"
25440980,521,58703,CRG,"dress code",0,"2022-06-25 19:06:11","Dress code"
25440979,171559,58695,CRG,reservations,0,"2022-06-25 17:40:42","how do you reserve a spot at the pool"
25440978,171559,58695,CRG,pool,0,"2022-06-25 17:40:42","how do you reserve a spot at the pool"
25440977,171559,58694,CRG,reservations,0,"2022-06-25 17:40:41","how do you reserve a spot at the pool"
25440976,171559,58694,CRG,pool,0,"2022-06-25 17:40:41","how do you reserve a spot at the pool"
25440975,171687,58692,CRG,noisy,0,"2022-06-25 17:09:36","3 - too many noise during the night with the stairs ( peoples going down like running and using washing machine at midnight. )"
25440974,171672,58684,CRG,"check out",0,"2022-06-25 14:41:03","When is check out"
25440973,171681,58683,CRG,"check out",0,"2022-06-25 14:11:54","Hey I asked last night but I can check out at 12?"
25440972,171629,58674,CRG,reservations,0,"2022-06-25 13:36:01","Didn't have my reservation my husband made on the phone nor would they honor the govt rate quoted on the phone."
25440971,171629,58674,CRG,phone,0,"2022-06-25 13:36:01","Didn't have my reservation my husband made on the phone nor would they honor the govt rate quoted on the phone."
25440970,171629,58673,CRG,reservations,0,"2022-06-25 13:36:01","Didn't have my reservation my husband made on the phone nor would they honor the govt rate quoted on the phone."
25440969,171629,58673,CRG,phone,0,"2022-06-25 13:36:01","Didn't have my reservation my husband made on the phone nor would they honor the govt rate quoted on the phone."
25440968,171480,58669,CRG,breakfast,0,"2022-06-25 12:45:45","When is breakfast served"
25440967,171779,58668,CRG,attractions,0,"2022-06-25 12:40:35",Attractions
25440966,171779,58667,CRG,distance,0,"2022-06-25 12:40:17","How far is citizens bank park"
25440965,171480,58666,CRG,breakfast,0,"2022-06-25 12:39:45","Is breakfast included with our room?"
25440964,521,58662,CRG,"cover charge",0,"2022-06-25 09:07:03","How much is it to get in ?"
25440963,521,58659,CRG,"hours of operation",0,"2022-06-25 06:50:47",hours
25440962,171572,58657,CRG,microwave,0,"2022-06-25 06:20:33","Is there a microwave in the rooms?"
25440961,521,58656,CRG,"dress code",0,"2022-06-25 06:08:57","Dress code"
25440960,521,58654,CRG,"cover charge",0,"2022-06-25 05:34:47","Cover charge"
25440959,171572,58653,CRG,"check out",0,"2022-06-25 05:09:40","What time is check out ?"
25440958,171572,58653,CRG,"hours of operation",0,"2022-06-25 05:09:40","What time is check out ?"
25440957,521,58652,CRG,"cover charge",0,"2022-06-25 04:45:34","Is there a cover"
25440956,521,58647,CRG,"cover charge",0,"2022-06-25 03:40:13","Cover charges"
25440955,171559,58640,CRG,"order food",0,"2022-06-25 02:26:17","can i order food from my room"
25440954,521,58616,CRG,"hours of operation",0,"2022-06-24 23:21:42","When did you guys open this club?"
25440953,171559,58613,CRG,"room upgrade",0,"2022-06-24 23:17:22","Can I upgrade my room"
25440952,521,58611,CRG,"bottle service",0,"2022-06-24 23:08:36","A bottle"
25440951,521,58610,CRG,"reserve a table",0,"2022-06-24 23:07:10","Vip table estamite"
25440950,521,58608,CRG,"reserve a table",0,"2022-06-24 23:06:28","How much is a vip table for this Saturday"
25440949,521,58607,CRG,"dress code",0,"2022-06-24 23:05:55","Dress code"
25440948,171633,58605,CRG,wifi,0,"2022-06-24 22:55:42","Necesito acceso al wifi"
25440947,171613,58604,CRG,wifi,0,"2022-06-24 22:50:54","Wifi password"
25440946,171622,58601,CRG,shampoo,0,"2022-06-24 22:38:08","Thank you! Is it possible we could get more conditioning shampoo in room 205?"
25440945,171687,58593,CRG,refrigerator,0,"2022-06-24 21:49:08","Hello. Our fridge /freezer doesn't seem to be working"
25440944,171687,58592,CRG,refrigerator,0,"2022-06-24 21:49:07","Hello. Our fridge /freezer doesn't seem to be working"
25440943,171637,58591,CRG,Check-in,0,"2022-06-24 21:48:04","Tengo Check in Lunes 27 de Junio, Fiesta Americana Condesa 2 habitaciones vistas al mar, es correcto"
25440942,171687,58582,CRG,wifi,0,"2022-06-24 21:13:57","There's only beach house and sea house guest. The password doesn't work for either"
25440941,171687,58580,CRG,"not working",0,"2022-06-24 21:12:45","We tried to wifi password but it's not working"
25440940,171687,58580,CRG,wifi,0,"2022-06-24 21:12:45","We tried to wifi password but it's not working"
25440939,171672,58578,CRG,"shuttle service",0,"2022-06-24 20:58:00","Do you provide shuttle to grayhound bus station?"
25440938,171681,58576,CRG,Check-in,0,"2022-06-24 20:53:55","1- a manager checked me in without me signing a document. I wasn't there then I changed it to two nights and since Brian checked me in already they charge me three nights then reversed it unbelievable"
25440937,171681,58576,CRG,"check out",0,"2022-06-24 20:53:55","1- a manager checked me in without me signing a document. I wasn't there then I changed it to two nights and since Brian checked me in already they charge me three nights then reversed it unbelievable"
25440936,171681,58575,CRG,bar,0,"2022-06-24 20:53:49","Is there food at the bar I can order"
25440935,171681,58572,CRG,"hours of operation",0,"2022-06-24 20:39:43","What time does the bar open"
25440934,171681,58572,CRG,"hours of operation",0,"2022-06-24 20:39:43","What time does the bar open"
25440933,171681,58572,CRG,bar,0,"2022-06-24 20:39:43","What time does the bar open"
25440932,171637,58567,CRG,reservations,0,"2022-06-24 20:08:45","Can we make dinner reservations"
25440931,171637,58566,CRG,phone,0,"2022-06-24 20:07:42","Is an app on our phone available"
25440930,171637,58565,CRG,Check-in,0,"2022-06-24 20:07:15","Is there an app we much download prior to check in"
25440929,171687,58562,CRG,pool,0,"2022-06-24 19:53:29","Why is the pool closed"
25440928,171629,58561,CRG,pool,0,"2022-06-24 19:52:03",Pool
25440927,171629,58559,CRG,pool,0,"2022-06-24 19:51:40","Where the pool"
25440926,171454,58547,CRG,"not working",0,"2022-06-24 16:27:43","My ac is not working"
25440925,171454,58546,CRG,"extra towels",0,"2022-06-24 16:25:43","I need a towel"
25440924,171454,58545,CRG,wifi,0,"2022-06-24 16:25:27","Wifi password?"
25440923,171454,58542,CRG,"extra towels",0,"2022-06-24 15:54:44","Need a towel"
25440922,171559,58540,CRG,breakfast,0,"2022-06-24 15:19:05","Can we order breakfast to our rooms?"
25440921,171859,58538,CRG,microwave,0,"2022-06-24 14:52:52","Do you have microwave in the room"
25440920,171859,58537,CRG,breakfast,0,"2022-06-24 14:51:51","You have breakfast"
25440919,171615,58535,CRG,"hours of operation",0,"2022-06-24 14:23:53","Consider implementing quiet hours"
25440918,521,58534,CRG,"bottle service",0,"2022-06-24 13:34:17","I want a vip table tonight with a bottle how much would it be"
25440917,521,58534,CRG,"reserve a table",0,"2022-06-24 13:34:17","I want a vip table tonight with a bottle how much would it be"
25440916,171645,58531,CRG,blankets,0,"2022-06-24 12:29:27","We just need 6 towels and a blanket for tonight."
25440915,521,58529,CRG,"bottle service",0,"2022-06-24 07:20:50","Bottle service"
25440914,521,58527,CRG,"cover charge",0,"2022-06-24 07:09:32","Cover charges"
25440913,521,58526,CRG,"reserve a table",0,"2022-06-24 07:09:10","VIP table pricing"
25440912,171532,58525,CRG,wifi,0,"2022-06-24 05:04:00","How is the internet?"
25440911,521,58523,CRG,"reserve a table",0,"2022-06-24 04:40:16","Table prices"
25440910,171644,58520,CRG,phone,0,"2022-06-24 03:42:52","Phone doesn't work"
25440909,171644,58518,CRG,wifi,0,"2022-06-24 03:42:17","Couldn't find the Wifi"
25440908,171688,58512,CRG,wifi,0,"2022-06-24 02:22:22","Hay wifi en los cuartos?"
25440907,521,58495,CRG,"dress code",0,"2022-06-24 00:54:39","Dress code"
25440906,171480,58485,CRG,"hours of operation",0,"2022-06-23 23:05:26","Pool hours"
25440905,171480,58485,CRG,pool,0,"2022-06-23 23:05:26","Pool hours"
25440904,171644,58476,CRG,"not working",0,"2022-06-23 22:19:45","password is still not working"
25440903,171644,58476,CRG,wifi,0,"2022-06-23 22:19:45","password is still not working"
25440902,171644,58470,CRG,wifi,0,"2022-06-23 22:04:49","the wifi password does not work"
25440901,171649,58468,CRG,wifi,0,"2022-06-23 21:51:24",Wifi
25440900,521,58462,CRG,"reserve a table",0,"2022-06-23 21:34:26","How much is vip table"
25440899,171557,58461,CRG,wifi,0,"2022-06-23 21:31:21","I can't sign into WiFi for some reason"
25440898,171557,58455,CRG,gym,0,"2022-06-23 20:43:01","Where is the gym"
25440897,171557,58455,CRG,location,0,"2022-06-23 20:43:01","Where is the gym"
25440896,171672,58440,CRG,breakfast,0,"2022-06-23 15:34:13",Breakfast
25440895,171672,58434,CRG,"checkout time",0,"2022-06-23 15:16:57","Checkout time"
25440894,171685,58433,CRG,coffee,0,"2022-06-23 15:00:07","Our room did not have a phone, coffee maker, microwave or even a plastic cup."
25440893,171685,58433,CRG,microwave,0,"2022-06-23 15:00:07","Our room did not have a phone, coffee maker, microwave or even a plastic cup."
25440892,171685,58433,CRG,phone,0,"2022-06-23 15:00:07","Our room did not have a phone, coffee maker, microwave or even a plastic cup."
25440891,171685,58432,CRG,coffee,0,"2022-06-23 15:00:07","Our room did not have a phone, coffee maker, microwave or even a plastic cup."
25440890,171685,58432,CRG,microwave,0,"2022-06-23 15:00:07","Our room did not have a phone, coffee maker, microwave or even a plastic cup."
25440889,171685,58432,CRG,phone,0,"2022-06-23 15:00:07","Our room did not have a phone, coffee maker, microwave or even a plastic cup."
25440888,171589,58429,CRG,"check out",0,"2022-06-23 13:37:30",Checkout
25440887,171787,58422,CRG,"late checkout",0,"2022-06-23 05:26:09","What are the charges for late checkout?"
25440886,171787,58421,CRG,"checkout time",0,"2022-06-23 05:26:03","checkout time"
25440885,171787,58420,CRG,"checkin time",0,"2022-06-23 05:25:53","checkin time"
25440884,521,58417,CRG,reservations,0,"2022-06-23 04:06:09","Change a reservation"
25440883,171637,58386,CRG,reservations,0,"2022-06-23 00:26:55","Can we make dinner reservations for the evenings of our stay"
25440882,171637,58384,CRG,reservations,0,"2022-06-23 00:26:37","Can we set up dinner reservations?"
25440881,171779,58380,CRG,"check out",0,"2022-06-23 00:02:02","What time is check out"
25440880,171779,58380,CRG,"hours of operation",0,"2022-06-23 00:02:02","What time is check out"
25440879,171687,58345,CRG,"not working",0,"2022-06-22 21:45:04","The WiFi password is not working.  Can you help?"
25440878,171687,58345,CRG,wifi,0,"2022-06-22 21:45:04","The WiFi password is not working.  Can you help?"
25440877,171779,58343,CRG,wifi,0,"2022-06-22 21:36:46","Wi-Fi password"
25440876,171779,58343,CRG,wifi,0,"2022-06-22 21:36:46","Wi-Fi password"
25440875,171583,58342,CRG,phone,0,"2022-06-22 21:32:34","Trouble verifying your phone number? See https://fetchrewards.zendesk.com/hc/en-us/articles/6699607918995-Phone-Number-Verification-Issues
Other issues? Use the Contact Support feature in the app"
25440874,171685,58337,CRG,wifi,0,"2022-06-22 20:58:48","Whats the wifi"
25440873,171637,58326,CRG,"tour packages",0,"2022-06-22 20:10:33",Tours
25440872,171779,58311,CRG,amenities,0,"2022-06-22 18:40:39",Amenities
25440871,171779,58310,CRG,attractions,0,"2022-06-22 18:40:29",Attractions
25440870,171685,58306,CRG,phone,0,"2022-06-22 18:24:23","Don't have a room phone"
25440869,171649,58303,CRG,wifi,0,"2022-06-22 18:03:19","WiFi password"
25440868,521,58300,CRG,"event room",0,"2022-06-22 17:39:23","But there is private event option on youy website"
25440867,521,58299,CRG,"event room",0,"2022-06-22 17:38:10","Hi, I'm looking for private event party, could you please inform me more information"
25440866,171222,58294,CRG,"extra towels",0,"2022-06-22 17:17:25","I need a warm clean towel"
25440865,171222,58293,CRG,"late checkout",0,"2022-06-22 17:16:31","Who much do you charge for late check out"
25440864,171222,58292,CRG,"late checkout",0,"2022-06-22 17:16:12","Is there a late checkout option"
25440863,171222,58291,CRG,"checkout time",0,"2022-06-22 17:15:51","What is the check out time"
25440862,171557,58288,CRG,laundry,0,"2022-06-22 15:36:43","Is there a laundry"
25440861,171557,58286,CRG,"hours of operation",0,"2022-06-22 15:19:41","Is there a cash machine/ATM close by"
25440860,171615,58284,CRG,"check out",0,"2022-06-22 15:16:15",Checkout
25440859,171613,58282,CRG,breakfast,0,"2022-06-22 14:48:31","Is there continental breakfast"
25440858,171613,58281,CRG,"checkout time",0,"2022-06-22 14:47:42","When is check out time"
25440857,171637,58280,CRG,"room service",0,"2022-06-22 14:26:58","Room service"
25440856,171779,58269,CRG,"late checkout",0,"2022-06-22 12:42:25","Can we do late checkout? Also what attractions are close by"
25440855,171779,58269,CRG,"hours of operation",0,"2022-06-22 12:42:25","Can we do late checkout? Also what attractions are close by"
25440854,171779,58269,CRG,attractions,0,"2022-06-22 12:42:25","Can we do late checkout? Also what attractions are close by"
25440853,171489,58268,CRG,wifi,0,"2022-06-22 08:51:30",Wifi
25440852,171681,58267,CRG,"checkout time",0,"2022-06-22 07:57:56","When is my checkout time"
25440851,171681,58266,CRG,"check out",0,"2022-06-22 07:57:04","What is my checkout date"
